{
  "$schema" : "http://json-schema.org/draft-07/schema#",
  "type" : "object",
  "properties" : {
    "@context" : {
      "type" : "array",
      "items" : {
        "type" : "string"
      }
    },
    "credentialSchema" : {
      "type" : "object",
      "properties" : {
        "id" : {
          "type" : "string"
        },
        "type" : {
          "type" : "string"
        }
      },
      "additionalProperties" : false
    },
    "credentialSubject" : {
      "type" : "object",
      "properties" : {
        "dependsOn" : {
          "type" : "array",
          "items" : {
            "type" : "string"
          }
        },
        "description" : {
          "type" : "string"
        },
        "hasCertifications" : {
          "type" : "array",
          "items" : {
            "type" : "string"
          }
        },
        "hasMarketingImage" : {
          "type" : "string"
        },
        "hasName" : {
          "type" : "string"
        },
        "hasVersion" : {
          "type" : "string"
        },
        "id" : {
          "type" : "string"
        },
        "providedBy" : {
          "type" : "string"
        },
        "type" : {
          "type" : "string"
        },
        "utilizes" : {
          "type" : "array",
          "items" : {
            "type" : "string"
          }
        }
      },
      "additionalProperties" : false
    },
    "expirationDate" : {
      "type" : "string"
    },
    "id" : {
      "type" : "string"
    },
    "issuanceDate" : {
      "type" : "string"
    },
    "issuer" : {
      "type" : "string"
    },
    "proof" : {
      "type" : "object",
      "properties" : {
        "created" : {
          "type" : "string"
        },
        "creator" : {
          "type" : "string"
        },
        "domain" : {
          "type" : "string"
        },
        "jws" : {
          "type" : "string"
        },
        "nonce" : {
          "type" : "string"
        },
        "proofPurpose" : {
          "type" : "string"
        },
        "type" : {
          "type" : "string"
        },
        "verificationMethod" : {
          "type" : "string"
        }
      },
      "additionalProperties" : false
    },
    "type" : {
      "type" : "array",
      "items" : {
        "type" : "string"
      }
    },
    "validFrom" : {
      "type" : "string"
    }
  },
  "required" : [ "@context", "type" ],
  "additionalProperties" : false
}